{
  "$schema": "http://json-schema.org/draft-07/schema#",
  "$id": "https://github.com/Mosberg/minecraft-data-docs/tree/main/schemas/nbt/spawner_nbt.schema.json",
  "title": "Spawner NBT",
  "type": "object",

  "properties": {
    "SpawnData": {
      "type": "object",
      "additionalProperties": true
    },

    "SpawnCount": { "type": "integer" },
    "SpawnRange": { "type": "integer" },
    "RequiredPlayerRange": { "type": "integer" },
    "Delay": { "type": "integer" },
    "MinSpawnDelay": { "type": "integer" },
    "MaxSpawnDelay": { "type": "integer" },
    "MaxNearbyEntities": { "type": "integer" },

    "SpawnPotentials": {
      "type": "array",
      "items": {
        "type": "object",
        "properties": {
          "data": { "type": "object" },
          "weight": { "type": "integer" }
        },
        "additionalProperties": true
      }
    }
  },

  "additionalProperties": true
}
